,reviews
0,"Chose the airline so children can fly back to regional airports in the UK for university, and also because on the face of it,they look good value. I was surprised when I was charged over 100 pounds just to choose seats. When there are 4 people, this becomes very expensive. Other carriers such as Singapore don't charge. Also the Boeing 777s in the fleet are terrible, absolutely no room on them and a really uncomfortable long haul experience."
1,"Excellent in-flight service and really good helping people with limited mobility. I was travelling with sprained foot and they were good not only to pick me up, let me know what's next but also spoke good English and were very helpful."
2,My mom flew from Heathrow to Dubai on Friday 25th November 2022 on flight EK096 which was scheduled for 22:00 but unfortunately due to some problems it departed at 23:30 but Emotates Authorities did not bother about passengers to serve them dome food or refreshments while the flight wasn't boarding n which is not a very good sign of service n is a disgrace n disappointment thing.So I will make sure that  me or any of my family members or relatives do not fly from Emirates at all unless they imptheir services.
3,I have back problems so I take my own pillow on the plane. A tempur. I happened to forget it on the plane. When I called this morning they confirmed it is not in the lost and found!!! Why do Emirates not check the plane for forgotten items before allowing the cleaners on the plane!!
4,My flight from Dubai to Birmingham on March 25th 2020 was cancelled because of Covid. The booking was made through Opodo who will not refund me because they say Emirates have not refunded them. I thought Emirates were better this!
5,"I live in Australia and frequently travel overseas. One of very rude/disresctful Emirates  staff member in Lahore Pakistan weighed my laptop bag and fined me PKR Rs.23390/-. He was not providing me proper information and was not even willing to talk to me or guide me. I travelled in 3-countries over the period of 3-weeks using Emirates airline and no one weighed my laptop bag except for this unprofessional Emirates staff member who weighed my laptop bag. I travel frequently and this has happened for the first time that I was charged extra money to bring my laptop bag. None of the other airlines (Quantas, JetStar, Thai Airways, Malaysia Air, Oman Air, Etihad Air, Qatar Airways). Even Emirates airline did this only on this occasion or may be it was just this unprofessional staff member"
6,"Reserved Emirates flight from London Gatwick to Dhaka via Dubai. Booked economy Seat From LGW/DXB -Paid Upper Deck Seat . Dubai Dhaka Business Class. Reported at check in desk on time . Double check with counter that , when will get Wheelchair . The lady from counter replied that, not possible  to provide wheelchair as my seat is in upper deck. I asked her if any complications for wheelchair just arrange to drop me in boarding Gate. She told me not possible at all. If i will move my seat from upper deck to main deck then only possible . I asked her why . She told me we Emirates don’t provide wheelchair service in upper deck.  I asked her what will happen ,the passengers who needs wheelchair assistance & traveling in businesses class obviously seats in upper deck. She didn’t respond. Then , I been to the boarding pass counter incharge Emirates Staff- kristy as Dnata staff are not possible to make any decision without Emirates staff concern. She told me same . We can not provide wheelchair assistance in upper deck. I told her no need upper deck as I need until the boarding Room . She refused me . Very Worst Service ever in my life , received from Emirates Gatwick Airport Staff . Avoid Emirates , who need special Assistance I mean wheelchair . Avoid Avoid Avoid . Never recommend emirates again as emirates Paying RUD Staffs in Gatwick airport."
7,"Tourist class that feels like first class, great food, superb hospitality and the most comfortable seats an airline can have, top notch, 10/10!!"
8,"This was amazing, the seats were ultra comfy with loots of legroom and generous recline. My flight left on time. The food was very nice, it was a very gilling p, well cooked and still warm meal. The IFE, Emirates calls it ICE(information, communication, entertainment) Would definitely pay extra to fly again if it was an option"
9,10/12/22 Flight # A380-800 I was not feeling well and I wanted to order a coffee. I first contacted them through the app and they told me to call any flight attendant which I did. I ordered a coffee at 6 PM and we are about to land I never see the flight attendant with my coffee. Perhaps they were standing in the back laughing and chatting. Disgraceful! Their customer service sucks
10,"Boeing 777's are at least 10 years old - seats have been compressed to the point where there is barely any cushioning, so my backside was numb for the entirety of the flight. The seat in front is also guaranteed to be reclined in your face. Worse: tried to cancel a booking only to discover that the Covid freedoms are very much a thing of the past and was charged almost the entire cost of the flight in cancellation charges alone. There is no need for this. Bragging that they have ""the most generous baggage allowance of any airline"" is completely erroneous - you will be ripped off for this as much as for the flight itself. Keen to recoup your losses after the pandemic, Emirates? How about you don't leave this shortfall at the doorstep of your customers. Shameful."
11,"Emirates Airlines has a well deserved recommendation for excellence from all that I have heard in the past.We flew Emirates from Miami to Dubai and the flight was excellent. A truly comfortable Business Class, fine dining and attentive staff.  It was incredible how comfortable we were for 14 hours or so in the air.The area they truly are lacking is in their Customer Service.  I had an issue with their requirement for PCR tests at the airport because our vaccine card did not have a QR code.  When I looked at the web site, deep in the fine print was the information about that requirement.  What was truly upsetting is that multiple other travelers from other cities on direct flights on Emirates were not asked for QR codes.  I attempted to discuss this with Customer Service.  I admitted I had missed the information on their web site and the Emirates representative would only refer back to that admission on my part.  The Customer Service rep would not admit that the requirement information was poorly displayed.  Even though I had furthur comments to make, the Customer Service representative closed the discussion and I have been unable to receive further responses from them.  Great flight but soured by poor service, poor communication a lack of interest in the customer and a lack of transparency that was disturbing.An excellent business makes sure the customer is happy before, during and after the transaction.  An excellent business makes sure the customer is valued."
12,"Absolutely awful experience travelling with an infant. Flight attendant refused to provide bottled drinking water for making infant formula and out baby stroller was damaged in transit.  Emirates is trying to get out of paying compensation to replace the stroller in full. Do not use the airline if you’re travelling infants, absolute nightmare of an airline. Never again!"
13,"I agree with all the reviews terrible Airline. Our Luggage was so badly damaged they had to give us a new disgusting case to get us home, our case was part of a beautiful set of 3, We through there's away it was so bad, We got no compensation ""Shame on Emirates"""
14,I got a Emirates flight from Dublin to Dubai and Dubai to Sydney on the 6/09/2022.From Dubai to Sydney the man in the seat behind me would not let me put my seat down he put his feet on my seat.When I complained airline staff offer a middle seat I had a aisle seat.The person who cause the problem should be removed from his seat not me. Security is needed on the plane.Another problem when I got my baggage at the airport my clothes were wet.My baggage was left in the rain somewhere.
15,I love the airline I love the service but big business oil isn't the future and I just wish they would improve their ethical responsibilities. I still fly them for any long haul flights because of their fantastic service though
16,"God saves mankind from Emirates airline especially their staff in Ghana 🇬🇭, more especially those at Kotoka International Airport, Accra. Most of them are unprofessional. They discriminate and intimidate especially first time travelers. They lie through their teeth and think Ghana 🇬🇭 is an island. How I wish everyone will find it easier to take transit visa and skip emirates."
17,"Fine if you don't need any support from Customer Services. Absolutely appalling. Been trying to contact them for two months regarding a request to amend an existing booking. Multiple unfulfilled promises of calls back while they ""look into our query"". Advised to follow up via email, still no response after doing so several times. Useless and incredibly dissappointing. Going on holiday today with our request unresolved. Will never book with them again due to unresponsiveness."
18,"Flight attendants and crew least helpful.. Its not like service, more like doing a favour.Had to wait an hour after pressing the call button for them to come and even ask what is required. And then, it was 3 different crew members later, i got water. Was very difficult and inconvenient to keep my 7-yr old waiting for something as basic as water. Really need to improve service standards."
19,"Booked a round trip from London Heathrow (LHR) to Dubai (DXB) for 6 days.The experience was excellent. Multi-cultural cabin crew that will always serve to you with a smile. Their A380s are also cozy and spacious with plenty of legroom. Food they serve onboard is top quality and has got to be the best compared to any other airline. The LED lightings inside Emirates planes are also beautiful, relaxing with a somewhat calming effect; especially if it's a night flight. Would continue flying with Emirates any day."
20,"They dont treat everyone same, I wanted to change my flight dates and I can see online there were many flights available for the dates I wanted to change for when I called Emirates and told them I dont mind paying amendment fee but they code me higher price for the tickets which was cheaper on their website when I ask why I have been charging more they said the rule is different for existing customer. So buy new tickets in normal price but if you changing your tickets then you pay more plus the amendment fee. I dont know if its discrimination or what but is very unfair not treating everyone same.My call was transferred to INDIA call center where agents are very rude unprofessional and racist I would say her name was ALISHA. She argued with me for an hour on the policy for UK residents for traveling on family emergency. She kept saying she knows everything and when I asked her can speak to ur supervisor/manager as their is misunderstanding of Emirates terms and conditions for UK, she wont transfer my call and keep saying ""I know I'm right you dont need to speak to anyone as I said ma'am so I will not transfer the call to anyone as I know what Im saying and I know my job"" I find this whole experience very disturbing and very disappointed in Emirates. Qatar, Qantus, saudi and specially BA have much better customer service agents and they treat all the customers equal and fair by not charging more, the prices are equal to everyone new or existing customer."
21,"We travelled to Australia via Dubai on 13/10. The seats were okay - row 68 but the passengers in front reclined their seats throughout the entire flight (which they are entitled to) leaving us with very little space and made the 14 hour flight from Dubai to Australia really uncomfortable and draining. On the return trip I decided to upgrade to seats that offered more legroom. Don't bother! The seats, although giving more legroom are really small and very uncomfortable. The monitor for watching films is at a strange angle and tray is more suited to a 6 year old child rather than an adult. I was on the aisle seat and was bumped by passengers using the toilet and cabin crew and their trolleys. For me these were actually the worst seats ever and a total waste of money. This would be my top complaint for flying Emirates.The cabin crew were pleasant and the food was quite good. There are numerous films to choose from but they were not very good and I spent a lot of time trying to find something I could watch.Would I fly Emirates again?....……. Not too sure."
22,"God saves mankind from Emirates airline especially their staff in Ghana 🇬🇭, more especially those at Kotoka International Airport, Accra. Most of them are unprofessional. They discriminate and intimidate especially first time travelers. They lie through their teeth and think Ghana 🇬🇭 is an island. How I wish everyone will find it easier to take transit visa and skip emirates."
23,We traveled business class from NYC to Malpensa in October My luggage was damaged with no chance to repair it upon arrival to Italy I filed a report with an Emirates employee who took a picture and gave me a form with a claim number I'm disabled and she said that I could buy a new luggage and request a refundThe item damaged was a Delsey brand new USD 299 plus tax I sent an email with the email provided with no response They finally send me a request to inform the brand and year of my destroyed luggage and the receipt The employee responded Barbara Arinci send me another email saying that they do not refund for my luggage but only replace or repair Mine has no chance for repairs only replacement How do they replace my new Delsey if not buying a new one??
24,Have flown quite a few times. Not so good this time. Food standard has slipped a bit.
25,Worst company I’ve ever flew with. Trying to resolve an issue on their part is extremely difficult. Me and my son have the same name. We booked and paid for the flights but only one ticket was on their system. 1 hour 45 mins on the phone and still couldn’t grasp that we had the same name even though we clearly had different dates of birth. At the check in counter had the exact same issue there and back. Some Staff on the plane act as though they’re doing you a favour and act as though you haven’t paid thousands of pounds for the flight. One female crew member pulled her face and shook her head because I was waiting for the toilet and she needed to put things in there for landing. I had to change the flights because I had done the wrong covid test. Took nearly two hours just to explain what had happened. Was told they would cost an additional £680 (down from £3000) if I took the later flight. I agreed to pay the 680 so he transferred me a lady who stated I had to pay £1080. I questioned her but her reply was the same every time. She could answer me why her collet had said 680 but she was saying 1080. Only ‘it just us 1080’ over and over again. In 30seconds it jumped from 680 to a 1080 but couldn’t explain in the slightest why  I had no choice but to pay the 1080 if I wanted to go away with my children
26,I took flight EK0011 from DXB to London Gatwick and my experience was amazing especially with the service Of our cabin crew viktoria .
27,"Fine if you don't need any support from Customer Services. Absolutely appalling. Been trying to contact them for two months regarding a request to amend an existing booking. Multiple unfulfilled promises of calls back while they ""look into our query"". Advised to follow up via email, still no response after doing so several times. Useless and incredibly dissappointing. Going on holiday today with our request unresolved. Will never book with them again due to unresponsiveness."
28,"Booked a round trip from London Heathrow (LHR) to Dubai (DXB) for 6 days.The experience was excellent. Multi-cultural cabin crew that will always serve to you with a smile. Their A380s are also cozy and spacious with plenty of legroom. Food they serve onboard is top quality and has got to be the best compared to any other airline. The LED lightings inside Emirates planes are also beautiful, relaxing with a somewhat calming effect; especially if it's a night flight. Would continue flying with Emirates any day."
29,"One of the check in ladies at Copehagen refused to let me carry on my carry on baggage, despite having taken 12 other flights, including 2 other Emirates flights with no problems on this trip. I went and repacked a few things and lined back up and the same lady went and told every other agent about me. Her colleague with dark curly hair and darker skin was even more rude and unfriendly and it seemed like she set out to make my life hell. I have never been treated so poorly by airline staff. I ended up in tears and they couldn't care less. Honestly one of the worst flying experiences I have had. It isn't much better on board. The cabin crew are not overly friendly, you press the call button and it takes so long to get help you wonder if it worked. The food is also average, one of the meals was so horrible, I couldn't even eat it and they feed you at odd times.The entertainment options are terrible, most of the options I hadn't heard of to the point where I downloaded movies on Netflix to watch instead. All in all, for an airline that I was so excited to fly with, it hasn't been a great experience and I will be looking at other airlines before flying Emirates again that's for sure."
30,There is a prostitute working on the this company be careful. She went with my husband to hotel five palm on 27 september. She contacted him. Her namne on instagram is Imadiziy. I wrote to her that he is married didnt mind at all to sleep with him for money. Be careful WHO ur husband speak with who works as flyg attendant.
31,"Flight attendants and crew least helpful.. Its not like service, more like doing a favour.Had to wait an hour after pressing the call button for them to come and even ask what is required. And then, it was 3 different crew members later, i got water. Was very difficult and inconvenient to keep my 7-yr old waiting for something as basic as water. Really need to improve service standards."
32,"Hello Armineh,Good day! This is Elle, the agent you have spoked with yesterday regarding your refund request on the itinerary 72292249890462. Just a heads up that I just checked with the last email I've sent to Emirates but their reply is just an automated reply and doesn't still have the informations we need, such as waiver codes to process the refund. It has been 2 months since the cancellation of the flight and still no refund or compensation payment by Emirates airlines. I will keep an eye to this itinerary until the end of this day so you may save your time from calling us back until tomorrow. Please check your emails too from time to time.Sincerely,Elle N.Cheaptickets Customer Support Team"
33,Flight cancelled after boarding.Would not help me to book alternative flight to travel to a wedding.Waited hours and hours... They shouted and screamed at passengers.Next day flight went late again. Mixed up check-in for 2 flights.During transit in Dubai their staff shouted and insulted...Utter pants.Obviously they are a case of all make up and no knickers.
34,"If I could Give a Minus Star🌟  I would, it's been over a MONTH, The airlines Damaged, destroyed and went through my Bags.. I bought my Luggage in June 2022, I recently travelled to ZANZIBAR and Emirates personal BROKEN INTO MY BAGS and Gave me a DEAD bag.. to make the matter Worst, They did not respond to me with care, rather judgement if I bought the BAG when I did... With 21 Email Communications am Yet to receive a SOLUTION... Is it because of my RACE... Could  be, as whilst I was at the Airport I FELT so be LITTLED by the staff at the AIRPORT, And Making me Miss my FLIGHT! until a Man Named Mohammed who helped Me 13HRS LATER after being Spoken to anyhow, I had to Buy a ticket for my journey for their Mistakes so NOT ONLY MY BAGS WAS DESTROYED AND DAMAGE I had to purchase an EXTRA TICKET... HOW DO I TAKE THIS MATTER FURTHER as Until Now I feel Ignored, Not respected and unappreciated as a customer... This experience had Made NOT TO EVER BOOK WITH EMIRATES or EVEN GO TO DUBAI EVER AGAIN..."
35,"Tried to get a credit for cancelled flights!  Still won't sort for us even after leaving a review on here!!Terrible customer service!! never booking with them again!  when speaking to the customer service team, they refuse to even look into it further!!!"
36,"I have traveled with Emirates (booking reference:H3HKK2) and had a horrible experience in August and September 2022. I made a complaint to them with the following reference number: LON/X/JU/101019/7572977 regarding my experience on the trip and described the issues I experienced in great detail. The airline was not empathetic towards the poor experience, overall service, and discomfort they had caused to me as a passenger. They merely apologized and brushed me off. I am very disappointed and I was hoping after making a complaint, they would be more understanding and compassionate for the discomfort I experienced which was causd by them. Unfortunately, they do not care and do not do anything to make things better. I will be strongly considering using other airlines after this experience."
37,"Flew from Taipei to Dubai with Emirates. Booked leg room seats as I'm very tall. Sat in front of the stewardess and chatted with the one passenger in my row. Ended up leaving my expensive noise cancelling headphones in the case upon leaving as I was very tired. Asked about it on airport and was redirected to email the 'Dubai Airports Contact Center'. I built the whole case, was kept in the loop by this 'Dubai Airports Contact Center' for over 3 months, including hearing ""you are required to provide above details within 5 days. (19/7/2022)"", later on they wrote me ""Kindly be advised that we are in the process of preparing the item to be ready for your collection, we will advise you as soon as it’s ready."", then they told me ""kindly be advised we will advise you as soon it’s ready to be dispatched."". Finally they emailed me ""We have checked with the all the concerned units, but regrettably we did not receive any item that is matching the description given by you."" What a bunch of incompetence. I dropped about $900 on a flight and you can't even locate my item, let alone communicate properly about the process of finding it.Flight EK367, 07/09/22 [TPE-DXB]"
38,"We flew to Dubai to Male and back with Emirates . Booked leg room seats as my husband very tall . On flight home leg room seat had less room than normal seat . The seats were very expensive. There was less legroom than on normal seat . After writing to customer services as advised by a member of cabin crew who agreed with me , I was told in amongst terms and conditions it states leg room seats in certain areas of plane are restricted due to emergency exit so they would not give a refund on that seat as they apparently gave us the seat I requested!! I am appalled at the customer service reply . That seat SHOULD NOT have been sold as extra legroom . My husband was so uncomfortable on that 7 hour flight . Very difficult company to deal with , I will not be flying with them again"
