,reviews
935,"Prior to flying with Emirates we were told nothing but good things. “Best airline in the world” they said.Now brace yourselves, because you shall now hear the truth behind the marketing hype...Flying with Emirates is no better than any other large commercial airline.In fact, in our experience it fell far below the standards we were used to receiving on other airlines e.g. British Airways, Cathay Pacific, Virgin Atlantic, Singapore Airlines etc. Some of the main areas where Emirates falls below standards are:1. Customer service - cabin crew rushed through the motions as quickly as possible, at times there was lack of visibility of them and when they did appear mistakes were made e.g being asked the same thing more than once by different crew members, missing items when being served. 2. Aircraft standards - we flew in what looked like a very old A380 that hadn’t been well maintained. The touch screen entertainment systems were difficult to use being old touch screen technology, material on the seats were frayed and loose. We later flew on a newer aircraft for the second part of our journey but the only upgrade was a touch screen that worked. The quality and standard of the cabin were common and not what was expected when viewing their advertisements which boasts its got the best economy class with no need of being upgraded. 3. Entertainment options - I spent half of a 4 hour flight just trying to decide what to watch. Yes, Emirates do have a large selection of movies but they cater to a wide range of audiences instead of being mainstream movies. I settled for one new Hollywood movie which I hadn’t already seen and had actually heard of, the rest of the movies I watched were an exploration of another culture & language.4. Food - airline food isn’t usually the best, but Emirates in particular didn’t have very good options and overall didn’t taste great. In 4 flights I saw “chicken, mash potato and carrots” appear on the menu twice and could only imagine how bland that would be. When rejected the offer for food the cabin crew would seem very confused and shocked by my response.5. The flight - bumpy, loud ambiguous noises. We practically crash landed back at Heathrow. I don’t like flying as it is, this was like flying EasyJet.A situation happened during our first ever flight with emirates which explains the nature of how this airline operates and treats its passengers. After boarding and fastening our seatbelts, it took 45 minutes before the aircraft actually took off which delayed our journey by 30 minutes where we (and around 20+ other passengers on the flight) had limited time to connect to another flight in Dubai. No cabin crew were visible and there was no communication from the pilot to explain reasons for the delay, or that we would land late in Dubai.Once we landed, we only had 30 minutes to get to the next flight. Instead 20+ of us were told to move to a corner by Emirates ground staff and wait. No explanation was given, we weren’t being told what would happen next.We decided to approach the Emirates connection desk where there was even more lack of communication. The staff instead decided to tell my wife that she needs to be quiet when she was just asking important questions about how we continue our journey! I straight away asked for a manager.Instead of a Manager, a Supervisor appeared and rudely asked what the problem is. I told his staff member to explain the situation rather than me go through it all again. He pulled out a letter for Copthorne Hotel and forced this upon us telling us we need to stay there because there isn’t another flight for another 9 hours.We didn’t see the point going to and from a hotel that we didn’t want to stay in and wanted to know how we would be compensated for the 9 hour delay to our journey and holiday that Emirates had caused. He told us that we are economy and therefore we should only expect a Copthorne hotel to stay in for the delay and if we wanted to query compensation then we would have to email their complaints team. He told us we would find out the outcome in 24 hours. So far it has been a week and the only response we have received from Emirates is to say that they would come back to us within 30 days! He also told us that we should have read the terms and conditions of flying with Emirates before we can expect compensation, well we have done and it mentions delays caused where Emirates was not directly at fault e.g. adverse weather, technical failure... well we hadn’t been told the reason but I’m sure we would know if there was something so severe!Never flying Emirates again, I’ll stick with airlines that are reliable, treat their customers with care and respect and offer comfort."
936,"Emirates is one of my favorite companies to fly with! Used them a couple of times over the past two years and their onboard service has always been excellent! Gotta highlight one of the stewardesses - Carina from Brazil, I met her on my last flight and she made my long flight so much better! Thank you ..."
937,Well a month after returning to the UK I still have a damaged case. Customer service is non-existent! Would never fly with this company again!
938,"Not the airline everyone suggested it was. Prior to flying Emirates for the first time, I had been told nothing but good things. Firstly, I normally fly Singapore Airlines/Cathay Pacific when flying East so have experienced nothing but the best level of customer service etc. On the flight out with Emirates the first thing that I noticed was how poor the meals were. Possibly the worst I've ever come across with an airline, even budget ones and I'm not fussy when it comes to food. The breakfast consisted of two pieces of broccoli, two medium sized potato wedges, sliced carrots with bread, water and a small desert. It was barely edible. I had a connection in DXB and opted to skip meals on a couple of the flights as it just got worse. After the first meal my partner opted not to eat on any of the flights. As I am tall, I prepaid for extra legroom seats for me and my partner at an extra £600 in total for four flights. On the return flight, we had to reschedule our flight through no fault of our own and got to the airport early to ensure we still got the extra legroom seats. The check in staff advised us they could only offer myself extra legroom and not my partner as there was only one available. Upon boarding the first flight, we noticed 3 extra legroom seats still available right next to myself. They were then offered to the taller people on the flight and even though I'd paid for one of them, to avoid a commotion I just let it go and let the people sit there. On the second flight, even though I'd been advised I'd been allocated the extra leg room seat, upon boarding I could see that it wasn't, it was the seat just behind (a standard seat) great discomfort for someone who stands at 6'7. Upon returning home, I contacted Emirates for a refund for the seats we never received. They stated there was nothing they could do, as they offered us the seats on our original booking, and it was through no fault of their own that we had to reschedule the flight. They showed absolutely no compassion, and were happy to take an extra £600 on top of flights that already cost £1300 for a service they didn't provide. The time spent in the extra legroom seats did allow me to observe and listen to the staff. On each flight was a similar attitude. None of them liked working for Emirates and all discussed how they couldn't wait to move on from the company. It showed in their work. I observed them kicking plastic cups/rubbish instead of picking them up. They weren't very forthcoming with beverages. I watched a piece of rubbish be dropped by the toilets early on in the flight and sat and watched how many times members of staff would walk past it without picking it up. It was at least 30 times. Something you'd never witness on the likes of Singapore Airlines. Prior to flying I repeatedly saw the commercial where customers approach the check-in desk asking for an upgrade and the commercial advises that there is no need as Emirates boasts some of the best economy seats in the world. This is not the case. It was standard seats on an aged plane. No different than economy seats on any other plane.Moral of the story, don't believe the hype, Emirates invests a lot of money into marketing, maybe some of that money should be invested back into their staff/planes."
939,"NOT impressed one bit!....checked in online in Dubai at hotel (had prepaid for 6 seats, same ones as outbound journey). Check in showed them as correct. Took suitcase to DXB & get boarding passes printed. Didn't check passes as pre paid seats and check in had already confirmed them. When I looked at passes at boarding gate 'ground operative' had moved  ALL 6 of us back 20 rows?????Where's my £130.00?????? for prepaid seats you changed without asking me.STILL WAITING FOR REPLY?????? 8 days later.I get the impression from reviews below that Emirates hope if they leave you long enough you'll forget about the complaint....ABTA or ATOL....hmmm"
940,TWO-FACED HUSTLERSEmirates Vacations Representatives are nothing but two-faced hustlers! It is the worse customer service experience I’ve ever had. It has been nothing but lies and more lies. I followed their complaint escalation procedure and requested a call or email from management but instead I keep getting calls from the same booking idiot who butchered my vacation. STAY AWAY! It’s not worth the aggravation.
941,"Flew from Seychelles - Kathmandu with a stop-over in Dubai. Very smooth check-in, transfer and collection of baggage, polite staff. Both flights were under booked and passengers were spaced out so that we had 2-3 seats each and could easily sleep! Will be using Emirates again."
942,"I recently traveled from IAD (Washington Dulles International Airport) to DEL (New Delhi, India) through DXB (Dubai).Everything looked fine until I reached Dubai Airport (DXB) before gate.My luggage was weighed by Emirates staff (One cabin bag and a laptop bag) and I was passed through. At next stage a female staff informed that I couldn't carry my cabin luggage as there is not much space inside the flight and I will need to Check-it in. I requested to carry it inside and explained it had original property documents which were very important and I couldn't check it in (I even opened my bag and showed her that there were only the documents). While I was talking to her immediately Mr. Mohamed (Seemed their Supervisor) came to me, grabbed my luggage in very rude manner and started taking to the other side, saying "" let me see now, get him deported"". took luggage back to weighing place and told I am not allowed to take a laptop bag. I explained that it is mentioned on my tickets that one carry-on item such as laptop is allowed.He said no it is heavier. I opened the bag and showed that there was nothing in the bag except the laptop. but he was acting really rude and was ignoring what I was showing him on ticket documents. he said your other bag is also heavier than allowed limit and I will need to pay the money for that.I told it was already passed from Washington Airport as well as here (Dubai) also. It was just that he was trying to harass me. He was being extremely rude and said he will make sure that my flight is missed. I was really in trauma while dealing with him as it seemed that he was trying that my flight is missed. As I was in a different country I was really afraid. He was not allowing me to go. It looked like that other emirates staff there was also not comfortable with his behavior. One of the staff member who had weighed my luggage earlier and allowed slowly told me that I could complain online about him. I tried to ask his name but I was told that they couldn't tell his name. which later I saw on him uniform that his name was Mohammed. Finally I requested him to let me go and I will pay the amount whatever additional they charge. I felt it like a ransom. After a lot of request and paying the amount he allowed me and told the staff to still check in my luggage and didn't allow in the flight. I was really depressed after this incident and I was scared about my return flight if somehow this person is there again he may put me in trouble again. He shouldn't have behaved like this. I was surprised why these kind of criminal mentality people are serving in such a service field. I will never take Emirates in future for me and my family, I have also told my friends about this incident and have suggested to not to use Emirates for flights touching Dubai."
943,Ruin My sister Wedding. Due to their staff negligence lost our Baggage all value able items for wedding been lost. Even Important Items like Wedding Day Clothes. Spent our First week on Airport chasing Emirtates Staff. We booked Tickets from U.K call centers are in rest of the world they dont have access fully for all information. No customer Service available in United Kingdom. Dubai Customer Service not helpfull. After ruining my sister wedding they offer half componsenation for items Lost no explanation given just few word from Dubai office this is our company policy. Bottom Line they dont care . will never fly them again . Qatar or Turkish airline will be prefernce now on.I am thinking to open petition against them. if company is making so much money from U.K customer they should be liable and have some sort of office in u.k because Dubai law does not apply here this is why they dont care .
944,Emirates ruined my vacations completely! Had a really awful experience with Emirates. On our way back from Jakarta to Dubai our flight was cancelled and Emirates never notified us. As a result we showed up on time of our original flight only to find out that Emirates moved us to an earlier flight without notifying us! Emirates refused to sit us on another flight and we had to buy new tickets back home all the way from Jakarta to Moscow. Even after that incident for 3 months already I’m struggling to get a confirmation that my flight was cancelled to get a compensation from my travel insurance company. And guess what? For 3 months I encounter the heaviest bureaucracy I’ve seen in years! And zero result. Never again I will fly with Emirates! Beware!
945,Flew to South Africa recently. Was a great trip. Air crew was very friendly and they had awesome films
946,"I booked flights from Bodrum to Dubai with Emirates in November 2017 through Tripsta.  On January 3rd I received an email from Tripsta saying I could transfer to a different flight, (but it was a night flight and would mean paying an extra nights accommodation) or I could cancel the flights.  When I was originally booking my flights, I saw two night flights, which would have been significantly cheaper, but I decided to pay more for the day flights, as I prefer day time travel.   I contacted Emirates to explain that this cancelled flight would cost me an extra £80 for another nights accommodation and that if I'd booked this flight in the first place, it would have been over £100 cheaper, so I asked for compensation.  I was told this was not possible, so I opted to cancel the flights and rebooked with another airline.  This was  now 5 months ago, and I've tried contacting both Tripsta and Emirates numerous times and just keep getting fobbed off.  Tripsta claim that it is Emirates fault as they are still waiting for the refund from them.  (Last email from Tripsta 29th May 2018 "" Kindly note that we have been chasing Emirates Airlines for a long time, but  they have informed us that this is their refund process and there is no way to hurry up their procedure.""  They have informed us that the request is till in progress and they will inform us as soon as the investigation will be closed"". I called Emirates (very unhelpful lady, who just insisted I filled in a complaint form, no sympathy at all) and then I emailed using their complaint form, showing them numerous emails from Tripsta, blaming Emirates for the delay, and all I got back was a response saying I need to go through Tripsta, no apology, no  explanation as to why they had not yet repaid Tripsta.   Very disappointed, as I was very impressed with Emirates when I used them to fly to Thailand.  5 months is not acceptable to be waiting for a refund."
947,"Briefly : Emirates used to be excellent, I am (was) a loyal customer and I have been flying with them for the past 8 years. However, I have noticed a big decline in the quality of their service in the last few years. The price of flying with them has not gone down however. You can easily find an airline just as good for much less.Long version : I have been flying Emirates for long haul has much as possible, several round trips a year for many years. Yes, flying with them is much more expensive than with someone else but it was worth it.Now not so. First of all, the general quality they provide has been going downhill, even in Business Class. My last trip and the reply I got from customer service are what made me lose all faith in them and switch to someone else, whom I will review next month after I fly with them for the first time but it looks promising so far. My last trip: 1) CDG Airport, the counter lady was just awful. She talked to me in a way no one ever did before. No hello, no thank you, just commands ""passport"" ""luggage on the side"". And she didn't even give me the time to carry her orders. I was opening the passport at the appropriate pages to make it easier for her, but after 1 second of telling me to give her my passport she yelled ""I said give me your passport"". Anyways, she gave me my tickets and I left. This is not the worst experience I have with an Emirates counter lady. In 2014 I was going to Phuket from CDG via DXB. I get to the counter and while the lady processes my passport, I take a photo of the screen above her. She was convinced I had taken a photo of her (why would I even want a photo of her??) and she called me names and threatened to sue. She didn't give me back my passport and yanked my phone out of my hands and called her two buddies from security (she was clearly friends with them). They told me to wait while they went through my phone!! After 20 minutes, the flight purser came and gave me back my belonging and escorted me to the gate. Back to my last flight.2) I arrive at my seat, disgusting, stained and full of crumbles. I politely ask the flight attendant if there are any seats left and she said no, the flight was full. I had to deal with my disgusting seat on my own and clean it as best as I could.3) In flight, the crew looked like someone died. I've never seen an Emirates cabin crew like this. In fact, one of my best flying experience was with the cabin crew of a flight from DXB to SIN in Business Class with Emirates.4) DXB to BNE, nothing out of the ordinary until I reach inside the pocket of the seat in front of me to grab the Open Skies magazine and get cut by a crushed plastic glass from a previous flight. Seriously do they not clean their planes anymore? It wasn't bleeding too much so I took care of it myself. Moving on, I got sick 1 hour after eating the in meal flight, I felt really bad so I talked to the flights attended who were genuinely concerned and wrote down my account on a notebook (i saw her write it down with my own eyes). This is not my complaint, everyone knows in flight meals aren't the best and they are known to make people sick, my complaint is with the subsequent customer response I received. After flights :I contacted Customer service and explained all of the above, in a nicer and more detailed way. After more than a month, I receive this answer ""Dear Mr Michael,Having reviewed the details of your flights, unfortunately, I was unable to locate a report completed by the cabin crew, pertaining to your experiences. Nevertheless, I have noted your comments and observations and have conveyed this to our Divisional Senior Vice President Service Delivery for his internal review.May I respectfully suggest that should a similar incident ever occur again, that you request the help of the Purser on board, at the time of the incident.  The Purser is the person in charge of all the cabin crew on the flight, will do all possible to assist, and will be in a position to clarify the situation, and log an official report.Thank you once again for writing and allowing me to respond.  Yours sincerely,  Caroline G*censored****Customer Affairs""That's it, no apologies, and they dare say there is no written account of my sickness of board although I saw the flight attendant write everything down with my own eyes. The only reasons I gave 2 stars and not 1 :1) Like I said, one of my best flight was with Emirates and their amazing cabin crew at the time.2) Their huge fleet of A380s which is my favorite aircraft."
948,"Currently sitting in the Emirates Business lounge in Dubai after the most shocking ever customer experience at Dubai airport. I was travelling from Manchester to Chennai for 2 nights for business meetings and the flight transited through Dubai with only 1 hr transit time which seems to be quit common as my wife and I experienced this last year when we flew business via Dubai for our honeymoon . I got off the Dubai flight at 20.25, and even though the Chennai flight wasn’t departing until 21.00 I was met at the gate to be told I’d missed it and they were going to re-book me on the next flight tomorrow. This flight being suggested turned out to be 24 hrs later and at 21:00 via Bahrain thereby losing a whole day in Dubai and adding a few extra hours going via another location.However, after looking online directly myself, I could see there were 3 earlier flights directly to Chennai, but I was told I couldn’t have a seat on those 3 because they only had business class seats available and they could do nothing to upgrade me. After then going to the Emirate ticket desk and suggesting to pay for a business class or first class ticket I was then told I could go on the 02.45 flight for £650 which I agreed to, When booking, her manager then said this wasn't possible as the price only applied to an upgrade and as I wasn't on the original flight this would not be possible. The next option that was presented to me was a business class ticket for £3,000, even though I could see the seat for sale on the Emirates website for £817 if i just purchased the ticket fresh.I said I would just book it myself and pay the £817 but the manager told me I had to wait while he disassociated the return flights. It took him 20 minutes on hold to the reinvent department and while waiting someone else waiting in the que just went and just purchased the last seat available. He therefore offered me instead a flight back to Manchester at 03.00 as the best solution. So in total I spent two and a half hours at the checking desk and will be spending a further 4 hours in the business class lounge that I was told they couldn’t even give this to me complimentary and I would have to pay $108 myself for this access.The customer service throughout has been disgusting, no courtesy, no empathy and had they told the truth about the business class availability on the other flights sooner I could have taken that option. There is a total disconnect between all their systems and from everything else I heard while waiting it seems all flights are over sold and that is the real cause of all these issues!!!"
