,reviews
672,"Flight to Dubai delayed 14 hours in Manchester.  Arrived for connection in Dubai to have to wait 3 days!  I know there was a flood, this is not uncommon in Dubai but why fly my family into utter and complete chaos?  It was one of the worst experiences I have ever had.  Queues for 15 hours...unable to leave the queue to go the toilet because you would not get back in.  Fellow customers and staff hostile and aggressive in the queue and Emirates did nothing, absolutely nothing to alleviate the situation.  Spent 4 days getting to a 10 day holiday for my daughters 18th birthday.  We didn’t even have our bags in Dubai.  They told us they didn’t have a hotel and to come back in 3 hours to the 15 hour queue.  Honestly you couldn’t make it up and when I asked an Emirates official why they couldn’t help to alleviate the situation, put on more staff and offer information etc the reply I received was threatening...’Madam, everyone is in the same situation,’. I will never fly Emirates again.  I understand there was a flood but to be treated so shockingly and to be left for 3 days in a country without a hotel or bags was abominable."
673,"I used points to upgrade myself on a red eye from Edinburgh to Dubai - and have previously found the service and the food to be quite good on Emirates First Class. Not this time around. Not only was the food bad, it was poorly prepared, served lukewarm and the crew clearly did not really care.Shrimps hard as rock and very dry, sinewy lamb masala. And yet another Emirates flight with a long wait for a bus to the terminal - in their own airport."
674,"I have traveled Business Class with Emirates for 8 years, and I remember the first time, which I enjoyed excellent service on-board , amazing plane, great lounges and customer service, if you needed them were knowledgeable and very helpful and polite.....Move to 2020 and if you ring customer service 5 times, you will get 5 different answers, if you can understand them. The planes are grubby, the service on-board can sometimes be poor and their lounges are now generally poor in comparison to competitors.Emirates need to up their game or they will lose their most loyal passengers."
675,"I wanted to share my Emirates experience to warn everyone how bad it is. Our outbound was delayed from Newark and I was concerned on our entire flight that we would miss our connection in Dubai.The host assured me Emirates had the ability to hold any flight for up to one hour, and that we would make our connection. We arrived only to find we had missed our connection by a mere 20 minutes. We were devastated, as this was the only flight out that day, and were told we would have to spend 24 hours in Dubai.There was no one on the ground to help us, so we made our own way to customer service. The staff were rude and completely unapologetic that we would lose 24hrs from our vacation - the only time I have to see my family every year. They just told us to go to the hotel and didn't give us any guidance as to how to get our baggage, or even where our baggage would end up. The flight they rebooked us on allocated us seats at the back of the plane, as if losing 24hrs wasn't punishment enough. We then spent a further 3 hours at the airport, trying to get our seats moved and also secure our baggage.Even more concerning than all of this, there was ZERO guidance around what it meant to enter the UAE and what we should be careful of medication-wise. When we went through customs to enter Dubai, they searched my bag and started questioning myself and my husband for sleep medication I had with me. It was incredibly disturbing and made even worse later finding out my husband had both Benedryl and pseudoephedrine - two over the counter drugs that are JAILABLE OFFENSES IN THE UAE without a prescription! This is a complete lack of duty of care by Emirates. What went from a delay, to losing a day off our trip, could have resulted in us both being imprisoned. This is absolutely disgusting behavior and not what I expect of what is said to be a 'premium' airline.The above, and the complete lack of empathy I received from Emirates staff has been a completely awful experience. Emirates should be ashamed you are charging the fees you charge for this type of treatment."
676,"The worse customer service ever in Delhi .i was offloaded as had dry coconuts in my suitcase and they assured me the plane will wait for me ,by the time they took me down to remove the stuff from the suitcase they closed the door even though I was there .they couldn’t care less and left me stranded in Delhi to book my own flight back and go and find a hotel at 1am .this was so dangerous for a lady .they were most unhelpful and charged me twice for no fault of mine .such such bad customer service .i expect a response to this complaint"
677,"First time flying alone and with Emirates - was due to fly back from South Africa to UK connecting in Dubai but due to delays with first flight from storm in Dubai I missed connecting flight. Was told before I left SA that I would already have been put on a later flight and just have to go to desk when I land in Dubai. Waited in a queue for 14 hours(!) as there were only two people behind the desk trying to help the 3000 passengers (I overheard one of them saying) needing to be redirected. Managed to get put on a flight the next day but had to sleep in the airport as they couldn't arrange a hotel for me. 23 hours in total spent stuck in Dubai! 2 hours after finally landing in UK I find out my bags are still in Dubai, and then hear from a second person that they are in UK but have gone to a different airport. Utterly disgusted with the entire experience and not what I would expect from Emirates."
678,They have the worst frequent flyer program I’ve ever used. Miles upgrades are almost never available.  And they don’t even have an availability Calendar on their website. You have to phone them to ask if upgrades available which is costly and time consuming.    And sometimes if you book  flight and phone back to upgrade and they are no longer available only a few hours later .  Horrible.
679,Booked my holiday in advance to try to secure best price as advertised 40%off only to find in the months before departure the price had come down by £1300!I know they work on a live system but £1300 really!!! I am travelling for my 40th so a special occasion which has been totally ruined. Called Emirates and they were not bothered at all. Won't ever use again.
680,Well for an airline its not a bad option especially if you want to visit dubai as part of your trip as well. But here is a catch i travelled first back in 2015 when i had a connection of 22 hours between flights but despite the fact emirates says they will provide complimentary dubai connect service where u can exit airport and will be provided hotel room and meal as part of it. But i was denied back than saying my ticket does not qualify even when i paid whatever the emirates website quoted me for. This time again on a long haul with family taking same flight been told same thing again. I have really no idea why they cant just say to buy business or first class to avail this service as we will not fulfill our written promise of website of giving same thing to economy class passengers. Will definitely avoid emirates from now on lesson learnt
681,"Well Emirates have lost themselves a frequent customer! Today at Auckland airport my husband and I spent half an hour with an awful person at check in who made us repack all of our bags in front of everyone simply because ONE of our hand luggage bags was 2kgs over weight. Both hold bags were under weight. I said we will simply pay a fine if necessary to avoid the stress but she said there is no fee for an overweight carry-on bag (so very unsure as to why she tried to make our life hell except to hold up the whole queue).I fly Emirates for both business and personal frequently (and thus my team and my family fly with them frequently too). The horrendous and stressful experience I have had today will mean I won’t fly with Emirates again (post my Bali trip I have next month with them). Unfortunately for Emirates, I work for a large corporate too and when I travel for business I will ensure my team never fly Emirates as well."
682,"Same que as the previous guy. Non existent customer service in Dubai airport. Rude staff, I was told all the hotels were booked up. I had to sleep rough in the airport for 20 hours, on top of a 3 hour delay from an earlier flight. The worst service I have ever experienced. Don’t fly with emirates. Oh and the inflight food is disgusting."
683,"First time flying with Emirates and it is an absolute joke! The staff aren't helpful. We have been waiting in a que for 13 hours to be told that we can get on a flight, but can't get our boarding passes as we can't get to the desk. They haven't informed any customers about what is happening. All Emirates care about is money by the looks of it! Will never ever fly with them again"
684,Would give them a zero. Shockingly bad!!Contacted then for reassurance as my flight is due to fly over Iraq/Iran. Most airlines are diverting flights but not Emirates. They have clearly been given a script 'we are in contact with the government and safety is out priority' which is just repeated over and over. Which is funny because every other airline is doing the safe thing and diverting. Originally told they had waived cancellation fees due to the situation only to speak to the next person and be advised that was bull. Unable to deviate from the script in anyway and actually provide clear answers. Wont be flying with them again! Pick an airline that gives one about its customers.
685,"1. Economy toilets disgusting - urine all over floor, bins completely full for basically the whole journey.2. Flight delayed, forced to rearrange flight. The airline put you up in the Capthorn Hotel. I would recommend you burden the cost yourself and don't stay there (let alone the 'free' meals they offer).Suitcase not given to passengers so had to wait a whole day without belongings. 3. Customer service completely uninterested, did not reveal to me they could have put me on another airline to avoid missing a business meeting"
686,"We have flown with Emirates for many years and have always found them to be good. We have booked to fly with them again in a few weeks' time, and when I checked the cabin baggage allowance, I was shocked -  7 kg , and only 1 bag allowed.These are new rules,so handbags etc., have to be put inside the trolley. This is lower than Easyjet and Ryanair ! It is difficult going away for a long holiday with valuables which cannot be put in the hold luggage ( i.e. cameras, binoculars, laptop). Emirates must know this, as they charge hefty fees for overweight cabin and hand luggage So, this is all about profits, and not the customer.If we also experience bad service, as many others have said in their reviews, we will never book with Emirates again."
687,"Interesting to read reviews about the poor service provided the Emirates. Can only agree.Had booked a flight from Perth to Copenhagen at New years eve, obviously with too high expectations. - The delay of 40 min from Dubai was met by no info nor appologize. - Crew members were openly eating/drinking, chatting, bored ... seemed tired. Have never ever experienced anything like that.Other delays, Dubai-Perth - no info."
688,"I have been flying Business Class with Emirates to and from Australia regularly for over six years and have been very happy with the cost and quality until recently. Suddenly on the last two trips delays, equipment failures and poor service have become common place. This week I wanted to move a journey back to the U.K in May forward a few weeks to coincide with my wife. Emirates wanted to charge me an extra £1750 despite having plenty of availability on the chosen flight. Having already paid a not inconsiderable sum for the original business class flight I thought this completely unjustified so complained to Emirates. The response was very unsympathetic stating that it is within their flight rules. Emirates fares have also noticeably increased and now other premium airlines such as Singapore Air compare favourably. So Emirates have now lost two of their longstanding and loyal customers and really don’t seem to care. If they continue in this vein there are in for major problems ahead."
689,"Terrible attitude for families, I travelled from Yorkshire to Manchester airport , checkin staff no interest, no option to upgrade to first and flight full of crew free loading and no where to be seen"
690,Bad food. Unfriendly service.
691,Worst flying experience ever.Flying business class with emirates is the same sa economy with qatar airways. Verry disappointing. The flight from bkk to phn I wassent even presented with the menu. The flight attenden asked me if I wanted the ceasersalat and I said yes please I never got it. When we landed and evry one stod up to leave the plane I went to the toilet. And rudly I was told to sit down again. On the way back to bkk I was not provided with the seat That I chose and insted I was provided with a wall seat. Don't use emirates business class pay more and go first class or save the money. And use economy.
692,"Our son needs medical food. We took enough with us for the whole journey of 10 days. It should be stored at room temperature. So not in the belly of the plane. They refused us, Only 5 bottles on board was excepted as handlugage."
693,I had a very bad experience at the counter when I asked about the long 10hrs stop over in Dubai and the option of providing the hotel room. The receptionist was so rude and not even helpful didn't even apologize for the inconvenience.
694,"SPOILED HOLIDAY! Will NEVER BUY A TICKET WITH EMIRATES, EVER AGAIN.* I finaly bought a ticket for my brother, 21 years to travel to Dubai for the first time by air. So i chose Emirates as the airline looked excellent. There were cheaper airlines like Kenya airways almost 2 times cheaper than Emirates. However i chose what i thought was the best airline. But no i was fooling myself. 14 August  2019 my brother boarded this Emirates from OR Tambo airport to Dubai. This was much awaited Holiday for my brother. The whole family had a happy farewell to my brother at the airport. It was a flight which was budgeted for 10 months. On arrival at the airport in Dubai same day, my brother was badly treated by the airport staff. The immigration contacted Emirates to change return date on the ticket to 15 August and never notified the passenger. This happened when the immigration said my brother s visa had a spelling mistake only in Arabic. It was not my brother who made the visa. It was the Agency there in Dubai which my brother had to contact to get them modify the error. When the visa was modified and error rectified, the immigration allowed my brother in. The problem came later when my brother wanted to return on the 3rd of November as on his ticket. His ticket date was altered by Emirates customer service through the immigration order. My brother was never informed both by Emirates and Immigration. News only came after from Emirates that the immigration s order was to deport my brother for such a simple error not made by my brother but the Agency which rectified the problem anyway. Both immigration and Emirates staff vey unproffessional to cause my brother to be stranded after all this money spent for this Holiday. When i contacted Emirates, they told me to contact the Agency i bought the ticket from and pay some more money to rectify the problem of this altered ticket. A problem they caused. The Agency i bought the ticket from in South Africa had nothing to do with cancelling passenger ticket for no reason. What foolish inconsiderate staff!!!. Spoiling customers Holiday. If i had bought a ticket through Kenya airways, would the Kenya airways staff had listerned to immigration at Dubai airport to cancel a customer ticket date but never notify the customer? I phoned the staff at Emirates about this, but all i was told was spend more money to get my brother back to South Africa.  Do not spoil your Holiday through Emirates. I used to travel with them before, of whom i am still a member but i will completely close all services with Emirates.I WILL NEVER RECOMMEND ANYONE TO TRAVEL BY EMIRATES. the Staff are very inconsiderate and less brains. The immigration staff at Dubai also do not have proper knowledge of handling passengers coming. They treat them like criminals like they treated my brother from Johannesburg."
695,The business class cabin gave a feeling of Economy for flying A380 from from Toronto to Dubai
696,"This airline has progressively been going down the tubes and it has now hit the rock bottom. Appalling ground service at Durban airport. Staff determined to impose maximum inconvenience on passengers. I regret choosing Emirates, won't happen again!"
697,"The most horrible land crew service. Discrrminated passengers deal to their nationality or class fare, Pls don't take airline, never ever. Deal with complaint like a week or even longer than that, and now, seems like NOT responding. So, I don't know what's customer mean to this airline?? Selling tickets? After that, then no service? Or you will have service if you are from certain race or you are on business /first class,I am now developing fear of flying, that I may be treated badly by the airline staff in the future again. I wrote some reviews about my experience here before, this is a follow up.I was treated badly and unfairly in the Brimingham airport.  The crew talked to me very very rudely deal to my overweight luggage, like I was a criminal.  Like I did something very very wrong,, like they are the police, or the customer officers, that I was taking drugs, or something.They only weighted my luggage before boarding, but not the other passengers I believed they discriminated me, because of my race or my class fare.  I put compliant to the customer service, didn't reply my complaint accordingly.  But, only like giving me 'copy and paste' statement, I felt like Im talking to the air.  then the lady ""Sabrina Liu' , closed the case herself, this was what she said""I am unable to offer you any additional information concerning the handling of this matter. """" Therefore, I am unable to offer you any additional information concerning the handling of this matter."""" We will now consider this matter closed."" I opened a new complaint saying I was not satisfied by their response, more a week, still no reply.PLS DONT TAKT EMIRATES"
698,"Another great set of flights with Emirates, flying from London to Dubai with a 2 hour stop over & then on to Bangkok Then from Bangkok to Dubai (5 day stop), then back to London.  Flights were on time, had a great selection of in flight entertainment, food & service excellent as always.  In my opinion Emirates is one of the best airlines I've flown with, & I've flown with a lot of airlines."
699,"Disgusting service during booking and upgrading, Emirates send a lovely email prompting you to upgrade to business class, but then surprisingly when you try to make a payment there is a technical error on their website!! If it only happened once then I can understand but for it to occur multiple times on different bookings , it seems a bit suspicious!! When the technical error occurs the website prompts you to call them, but when you make the call, they cannot do anything, you can only do this through the website!! And the staff you speak to are an utter disgrace, brainless robots, all they can say is no i cannot help, it is literally like banging you head against a wall, number 1 airline I don’t think so, I flew with Qatar a few time now  and they seem to provide a much better seamless service, and the staff actually talk to you as apose to reading of a script!"
700,"A great airline to fly with and usually easy to book online. But until Airlines like this recognize that they have to clean up all the plastic waste produced on flights, like forcing passengers to use a new Single-use plastic cup each time they want a drink, instead of encouraging re-use, I can't award them more stars. There's really no excuse. Airlines have an extra responsibility in this regard given that their industry is part of the problem behind the Climate Emergency..."
701,Mumbai baggage check is such a hassleNot sure why they have such small aircrafts
702,"Had the pleasure of flying with Emirates from Bangkok to Dubai and then Dubai to Hamburg the 12/12/2019. (flight EK0059).The steward (Roulondo) and stewardesse (Tahany) servicing passagers around my seat were genuinely super friendly and smiling at all times. They made the flight really pleasant and made me feel welcome at all times.Super staff and good service, food on the flight were above my expectations as well.Will definitely choose Emirates again for my next long distance flight."
703,"If I can, I will put -100 to recommend this airline to anyone Same as other reviewers over here, bad experienceFirstly, their response to comments/complains is very very slow, takes them days to reply the issue.It is not my first time flying with Emirates, I was very pleased and liked it, I recommended it to my families and friends. BUT, this time was so disappointed. It totally put me off, my family and friends off.I felt like I was being picked on or even being discriminated. There are 2 weights at the gate. The staff asked me to put my luggage on the weight. They said my luggage was too heavy, they fined me. Of course, it was reasonable to be fined if someone 's luggage is over weight, HOWEVER, even my luggage was over weight, they talked to me in a very rude way, like I was a criminal. MOREOVER, they weight passengers selectively, I saw some other people carried more and bigger bags than me, they didnt ask them to weight their luggage. I was the only one who was asked to weight the luggage before boarding. I was wondering why was ONLY me."
704,"I have always had pretty good experiences flying with Emirates and if prices were even between all airlines, I would choose them every time. As far as airlines go, I believe this is a good one!"
705,"My wife, 3 year old daughter and I traveled in business class to Dubai and then returned back to Gatwick a week later. On our flight out to Dubai the service we received was comparable to a low cost airline. Firstly I’d like to point out that the business class section was less than half full. A crew member came to take my lunch order before take off but was told my first choice dish had run out! I later saw a crew member eating the dish I had wanted to order for my lunch on his knew crouched in the section between first and business class. I had no option but to order a chicken sandwich. Something I’d expect on a low cost airline and not business class. On several occasions it took over 20 minutes for my drink to arrive. My wife had finished her meal before mine even arrived and her fruit salad had a mouldy raspberry in it. There was no choice for my daughter meal and when I asked I was told that’s all we have. If I compare this to say Etihad it’s worlds apart. On Etihad we experienced fine dining food and service as we did on our other business class flights with other airlines. I must say I did not feel this was a business class service or food selection or presentation and that we were more of an inconvenience to the crew and I definitely did not feel I got value for my money. Also on arrival to Dubai we had to wait 20 minutes for our car and were handed a baby seat which was basically too small for our child. Initially they expected my 5 month pregnant wife to install this seat in the car. Absolutely shocking service.The only good part to the car service was in the UK were our driver arrived at our home on time and installed the correct car seat and was very helpful. Disappointed beyond words. NOT WORTH THE MONEY. I would rather fly Etihad and drive to Dubai."
706,Some of the emirates services need to be improved
707,"Hello,I was travelling from London Gatwick to Dubai on 29th November 2019. And I had the worst experience ever in my life, I have been travelling a lot but never came across such staff. To take the name loud, miss or mrs Monika & her team has been too rude to me. I never knew laptop bag and ladies purse are supposed to be weighted in the hand luggage only, I have been travelling around the world but never ever came across this rule. I don't know whats wrong with those people, I am a student and I was travelling alone, they harassed me a lot by asking me to pay for extra luggage which is hand bag and laptop , on me denial of such rules, they asked me to go out of the airport and also asked me if I will not go they will call security for it. they have insulted me, I and all my near ones will never opt for such stupid flight where such crew is appointed, each and every staff of emirates was laughing at me because I was trying to adjust my luggage, on someone helping me with it, they again came to me and talked as if I am a beggar. most pathetic staff ever, they took 187 pounds from me. I will share this post and soon like other stupid flights, emirates will close down soon. this refund of 187 has to be given to me , as I won't tolerate this injustice of the staff."
