,reviews
306,"Horrible experience with Emirates even though I am a silver member. They have changed a confirmed booking twice - including dates/ wait time for onward journey/ etc. They assume they can simply do anything with your booking because you are at their mercy. When you call, guess what, call center simply rejects your call saying they can't take your call. Not for a little while, but days together. Now I worry that by the time I get through to Emirates call center, it will be too close to my travel date and nothing can be changed anyway.Want to complain to management? Good idea, you can't even find the CEO's name or email. THere is a Tim Clark who is CEO of USA but his email bounces. NOne of the other executive contacts listed have working emails!All this for spending close to $3000 for an economy ticket!"
307,"Yet another 2hr 45 min wait to speak to someone in an multinational organisation and not even an apology and when you get through, you are made to feel completely insignificant and they just try to fob you off! Tried to be put through to a manager and put back on hold and the original girl buggered off! Absolute disgrace.Good luck to any one who tries to call them! As always, if you call the sales line you get straight through! Funny that as no focus on customer care and just on sales!Emirates management - why don't you call your various departments to get to see the customer journey for yourself!"
308,Want to hear a joke? I was tossed around between Emirates and travel agency as none would agree to change my flight tickets so eventually Emirates customer service lady very smartly and seriously suggested me to organise a conference call between Emirates and lastminute.com customer service helplines so that Emirates tells off lastminute.com they are not doing their job and have policies to follow :) does anyone have tips how to best do that?
309,Emirates has cancelled my flight and there is no option online to make a change to this booking to a different date.Have called the customer service three times holding for more than 40 minutes each time and haven’t gotten through an agent yet. Not sure what I can do now
310,"It is difficult writing a review for most airlines at the moment, because they are generally terrible. I have flown Lufthansa (by far the worst), Qatar (almost equally bad), British Airways (so far the best of the main airlines), and Emirates. They all get a one star for customer service lines: BA is a little better because at least they give terrible service politely. Emirates has really long waiting times, but at least most problems can be solved."
311,"Has faced the worst experience in decades, on 25th October on flight EK 613, we were flying to London from Islamabad and were refused to onbaord by Emirates staff for not having passenger locator form. We are British Citizens, fully vaccinated, had negative PCR test reports and Covid-19 passes issued by the UK health authorities. Missed this form because my son was in hospital few hours before the flight on account of high fever and chronic cough. On 25th at airport we waited in the queue for check in for about two hours. While waiting one of the female members of the Emirates staff inspected the documents and said we are good to go. She didn't mention about passenger locater form at all. Same female staff member later took the picture of our passports and provided no explanation why she took the pictures. Entire Emirates team was extremely rude and unhelpful. That's why this has raised serious questions how Emirates Airline handles our personal information. Finally we reached at the check in desk after two hours and were told passenger locater form is missing. The check in officer, acted so arrogantly and become more intimidating when he read the Christian name of my son, and threw away our British Passports on the desk rather providing a piece of guidance, he challenged me I am incapable of filling out the forms. My wife was crying out her tears, my two years son who was unwell was distressed by the situation but unfortunately none of the Emirates staff members came forward to help us in this compelling family situation. They watched this drama for entire two hours but none of them even uttered a single word of compassion. This is a breach of basic human rights & family respect particularly when you have infant travelling with you. After this traumatic experience we drove almost 400 KM to Lahore Airport to take next flight to the UK and paid almost £1500, bought new Qatar Airways tickets to catch up our work commitments in the UK next day. I wish if Emirates staff in Islamabad could ever spare a moment to feel the pain which we have gone through.I am hoping to write to draw the British Foreign Secretary's attention to the inhuman attitude of Emirates staff in Islamabad who is employed to help us, answer our queries, find best solutions in problems not to come up with racist and discriminatory attitude to destroy the basics values of human respect, dignity and right. Qamar Rafiq"
312,"I booked a holiday to Dubai for the 4 of us in business class and traveled from manchester on the 11th October on the afternoon flight 2:20pm ish the staff on the flight our a credit to emirates and the Irish girl was amazing and really looked after us, I hope she reads this and keeps her glasses on.😎 she will know what that means, we come back on the 22nd October and the staff again was amazing I have flown on emirates at least 10 times and for me is the best airline, treat the staff with respect and not servants"
313,"What was supposed to be our first flight on Emirates is now our last! My wife and I met in Seychelles after being separated by the pandemic for roughly 2 years. We had planned to return to the Philippines where she is a citizen afterwards. Emirates was our first departing flight with two connecting flight after. Upon check-in at the desk, the Emirates supervisor on duty prohibited me from boarding the plane. She said I couldn't board because as a USA citizen I needed an existing visa. We attempted to explain that Philippines Bureau of Immigration allows a visa on arrival for foreign spouses traveling with their Filipino spouse under the Balikbayan program. We showed our original apostilled marriage certificate as proof. The supervisor stated their system indicated that I had to have a visa and that these provisions were not listed. We attempted to show multiple IATF resolutions that the Balikbayan program had resumed for several months, but she stated their system was updated daily with COVID restrictions/entry requirements. She added if I was allowed to board I'd likely be offloaded and deported in Dubai at our next flight. So, we agreed to follow up with the Philippines Bureau of Immigration. When asked for documentation regarding my offloading, the supervisor indicated she couldn't provide this and that I'd have to make an online complaint. We were able to confirm by phone and email from the Philippines Bureau of Immigration that I should be allowed entry under the Balikbayan program. We then showed this documentation to different Emirates supervisors at the airport who expressed confusion as to why I was prohibited to board in the first place. They agreed to independently confirm with Emirates airport staff in Philippines and the airport immigration officials. After they did, the airport supervisors confirmed we could rebook our flights and I would be able to board. HOWEVER, we incurred thousands of dollars of extra travel expenses while obtaining this confirmation. And other airlines refused to refund us our tickets without documentation as to why I was prohibited to board. When I requested this documentation from the online complaint system, I did not receive a clear response about the matter for 10 days. And that response added that the Balikbayan program didn't apply to me since I wasn't a Filipino even though I had already provided them emails from the Philippines BOI and the Emirates airport staff confirming I should be allowed to travel. I spent the next month continuing to email, resubmit documentation, and call anyone at Emirates who'd listen without any success. I did not receive any corrected documentation about the offloading, any financial compensation or flight credits, not even an apology acknowledging their initial mistake! Each time a Mr Ayman Nasser continued to cordially reiterate that they took  ""the matter seriously"" and ""have nothing further to add.""International travelers, especially Filipinos, should beware flighting Emirates! They're playing the role of immigration without the knowledge or authority to do so. We had to extend our time in Seychelles for more than 3 weeks trying to resolve this matter. I have yet to receive refunds for other flights we had to cancel and travel insurance has indicated this is not likely to be covered. This was a huge financial hardship in our early marriage. The online complaint system for Emirates is a travesty of a mockery! You can only upload 2 documents at a time. And you can't make multiple submissions without waiting for Emirates to reply. A week or two later. There's no one you can talk to about matters like this by phone either! I asked to speak with supervisors and managers multiple times without any success. Each time they (the call center, the airport staff, the city office) referred me to the online complaint system.  It was so useless I don't even know why they brothered to send me delayed replies. They didn't address any concern or ever explain why the airport supervisors could approve me to rebook and board but the online customer service could make say something completely different.I hope everyone separated by the pandemic makes better choices for airlines than Emirates. P.s. For anyone who questions the validity of my claims, I can provide you complete documentation of everything"
314,"Absolutely disgraceful , do not fly with these people, booked tickets 4 months prior, Emirates have cancelled the flight twice on me, trying to ring them back will not pick up phone. Now I have a flight going out but no flight coming back home, do not book with these people"
315,"I understand things happen and due to ""operational reasons"" flights can be cancelled.  This happened to me and I was not notified, no email or anything.  I then had to wait over an hour to get through to their customer services who after a while managed to resolve my issue minus the long stay at Dubai airport. (could have offered a hotel as a gesture)  Staff were like robots, no empathy or apology.  Standards have fallen.  Will be looking to use other airlines going forward.UPDATE: 04/11/21Return flights cancelled which means on alternative date connecting flight wait time is 17 hours.  Very poor service from Emirates"
316,"I fly to Dubai on average a couple of times a year and always choose Emirates Business Class, however their standards have really dropped following Covid and not only was the customer experience when checking in not good either in London or Dubai, my Emirates car didn't arrive to collect me in Dubai and I was forced to make my own way to the airport. I explained this at the time and they really couldn't care at all.  Such a shame because I used to really enjoy their service level and now it feels like a budget airline check in!"
317,cancelled flight last minute. offered overnight layover instead with no accomodation!! No other reasonable options offered.
318,"Worst customer service I have EVER received, with terrible crisis management and definitely racial profiling staff."
319,"Went to board a flight tonight (16th October 2021) from Manchester to Dubai. Got to the check in desk and was told by a Lauren Buckley she couldn’t let me on the flight as my passport had slight damage to it (a scratch which I wiped off). She then proceeded to infront of a airport full of people, my 3 month old daughter and myself start shouting at my partner telling him she won’t be apologising and she gets to decide who gets on her flight. Even though my face was clearly recognisable on the passport which she stated infront of everyone because there was a scratch she said it was damaged then when my boyfriend wiped it off she said we had tampered with a legal document. Everyone was shown the passport and couldn’t understand why she was refusing me to board. Slammed the passport on the side and told me to leave. When we spoke to our family who live in Dubai they couldn’t understand why she was doing is. We passed the phone over and not only was she rude to myself and my partner in front of our 3 month old and an airport full of people she was then rude on disrespectful on the phone to my partners mother. She said she was team leader and she gets the final say. We asked to speak to a manager and she said nobody was available and we were to listen to her. We then left the airport and she was rude and intimidating as we left. Lauren Buckley is not a person you want representing Emirates. What a shame as we’ve flown plenty of times most recently Christmas and always had a good experience up until now."
320,Booked a flight with emirates. Paid more for the tickets than other flights. Our connection time was 2 hour. They changed our connecting flight with 23 hours transit time without any explanation or compensation. We can also not cancel the flight and ask for refund. Now we had to pay more to get better connection. Absolutely terrible service. Will never book with them again .
321,What a great airline. I flew from London-Dubai in business. This is the best flight I’ve ever had. The service was outstanding. The seats are so comfortable and lie totally flat. The food is great. I didn’t want the flight to end
322,Disgusting and appalling customer service. They cancelled my fight due to 'COVID' reasons assured me that I could re-book anytime. When I contacted them to re-book told no economy seats available and would have to pay £800 for Business. They should honor their agreement and provide free upgrade. But they are just thieves exploiting people. Also they don't have a complaints section which speaks volumes. I know they have an online form but you try and get a response or even get it submitted due to it not conveniently accepting it due to typos.
323,"Can’t relate to all the bad reviews. Had to cancel our flights (very easily through online form) because of covid and received the refund like 6 days after. Phone Customer service is quite busy and you gotta wait for 1 hour to get through, but all the employees I’ve talked to were super nice and helpful! I think we all should be a lot more patient with airlines since they’ve had to face so many changes/restrictions due to Covid … Would always choose this airline again!"
324,"I would give this zero stars if I could. I just had a very distressing conversation with Emirates tonight when I called to discuss the allergy that we have with my little girl. Unhelpful doesn't even begin to describe it and you will not supply food without nuts or traces, will not ask passengers not to eat nuts on the flight or make an announcement and will continue to serve nuts on the flight. This isn't acceptable. My wife is so upset and I don't know what to do. If someone eats nuts next to us or touches things she then touches that could make her really unwell or worse. How is that acceptable to you?I am happy to bring her food on board. All I am asking is that you do not serve nuts on the plane and ask passengers to refrain from doing so. It's totally within your control and you refuse to do it.I guess I’ll just have to hope my little girl doesn’t have an anaphylactic reaction which causes her throat to shut. Thanks Emirates, a truly unbelievable set of events in this day and age…"
325,"Best airline still I have seen. I used it four times for my travel to Asia and Africa. One time my flight has been cancelled however, I got my full refund with 12-14 days."
326,"Doesn't deserved a one star, just a s*t company with s*i*ty staff. Incompetent people just want you to pay extra when not needed. Such an A**hole staff and include bloody manager. F**king disappointed with emirates"
327,Had a bad experience on flight home 007 .. quite traumatised.. made a complaint as a skyward member but cannot submit tried 6 times .. seems like they don’t want complaining…ek671203525
328,lost our tickets then upgraded us to first class at the price of economy!! love them
329,Unprofessional call center employee Refund is a big lie they don’t refound shttt
330,"They are too much proud of themselves. Their service is very bad on land and on air. The only thing is that they are showing of with young beautiful half naked girls apart from that nothing to help your journey’s relaxation. If you ask for a cup of water, you can hardly get one after a long waiting if you will have it.I don’t recommend at all."
331,We had to change our flight due to COVID and were treated wonderfully and politely by Tioia during the process.
332,"always doesn't fly on time, 30 to 40 minutes late and always put responsibilities on customers and don't allow them to fly when little bit late. Avoid this corrupted airlines."
333,"Promos offered by Emirates are fake. They simply refuse to provide me confirmed “free” ticket to famous Dubai entertainment show!!! Saying I’m not eligible while it is confirmed in my tickets! Absolutely awful experience.Do not expect to get service from Emirates even if you paid and got it confirmed.Do not trust their sweet offers, you will get nothing by the end of the day."
334,"I never recommend this flight company any more.This flight changed the time of my return ticket without my permit , although I had the email of our tickets and confirmation number.                       We explained to the UAE members at Ika Iran International Airport but they said we follow what we have in our system and your return time is one month later and your husband's return time is for today. This issue was weird that had happened for my tickets scheduled,we had bought our two tickets from kayak website in Sandigo, California at the same time, why it had changed like that?   Emirate said it was your agent’s fault (kayak), but I had my ticket confirmation number which were both probably issued by emirate .  They did not help me and their customer service was very poor and rude.  After three hours of stress and hopelessness a friend of mine in canada could finally call the UAE office in Sandigo and explained all the story.  They fixed the problem for me from there and I could pass the gate at the last few minutes.  That situation was very stressful for me and my husband , I was really suffering and crying and I could not believe how much the UAE customer service of IKA could ignore the customer's right and not show any correct reaction to solving the problems . IKA airport didn’t have WIFI and we didn’t have access to any call or internet. A janitor who saw me helpless, lended his phone to us for contacting and getting help.I want to make a lawsuit about Emirate flight for all negligence that they did .Apparently it is a normal incident for them but for passengers who may have a travel once in a while especially in this covid situation can’t be normal and they should help me and fix the ticket immediately right in Ika airport."
335,"If you use Emirates, you can stay without a ticket and without money. I had two tickets for this flight on 13 July. On 4 July, I was informed that Emirates had canceled the flight. I contacted Emirates customer services and asked about any alternative flight, and they answered that they could not do it. They proposed later flights on 16 July, but it was impossible for us because we had visas valid until 14 July. I told him about it. So, they suggested requesting a refund, I did it, but they refunded a small percentage of ticket costs. I had two two-way tickets that cost 800 USD each. They refunded  188 USD for one and 250 USD for another for one-way tickets. Then I knew that Emirates for such a canceled flight suggested Turkish airlines, but the customer service DID NOT suggest this option for me. I have screenshots of these text messages. I am very disappointed that Emirates canceled the flight and did not suggest how to fly from departure to the final destination. Besides, they refunded not the full amount of one-way ticket costs. I wrote feedback-complaint several times to Emirates, and they answered that the flights had been canceled according to the OAE government and could not help me. I DON'T recommend using Emirates. Try to avoid this airline, because they can deceive you and say: ""we are so sorry...""My booking references numbers are: Q3U766, DSJ3J2"
336,"Unfriendly staff, not helpfull, bad communicating with customers, customer service is too slow responding some times no respond , ignoring to answer customers, they looking for any reason to cancil your flght and lose your money if they found the weight of luggage is heavy .Avoid this airline and be sure if u buy non refundable ticket they may cancil anytime for any reason and you lose your money , this happend to my family twice , the reason was they are late while was 1 hour and 45 minutes to fly."
337,Very nice customer service by the lady on the phone. She was very polite and patiently helped me with my issue. It was very helpful.
338,"Me and my wife were treated horribly at Hanoi airport by Emirates' staff. We already have been delayed by the arrogant immigration office, which just wanted us to pay bribes. After sorting that out we had to go to a new table where the lady did everything to make our travel harder. First she wanted us to put our biggest luggage on the scale which measured 26kg, and she said we have to pay extra for that, OR we can move some of our things around to get wight out. At this point all of our luggage were covered with a plastic seal, so we couldn't remove that by hand, around 8 staff just watched me trying to get everything unpacked with bare hands, with no luck. They didn't offer to help, they didn't offer scissors or anything. I felt humiliated. As we had only 1 hour until the flight, I had to accept the $65 fine. Please note that previously I have checked with Emirates via phone how the weights work, and they said that we have 2x23KGs per person, and one luggage can go upto 32kg, as long as together not more then 46KG. Please also note, that all of our other luggage were well under weight, one of them only 8KGs! I also previously purchased a 23KG additional luggage just in case we would go overweight. Nothing mattered, they still pushed me to say yes to the $65, they also threatened me that we might miss the flight! After this the lady said that we don't have a booked flight from Tanzania (destination) to elsewhere, so she cannot let us go. This was very very disgusting, as we ALREADY had a visa to Tanzania, travel plans to Mozambique and Zambia which are both ""visa on arrival"" countries, they do not do evisas or other. We already presented these plans to the Tanzanian immigration and with these plans they accepted us and gave us the visas. But no, this was not good enough for the lady. She said she needs a flight. I had one booked previously, which I showed her, she said she cannot see it in the system, so again, we cannot go. She said that we need either a return or an onward flight. I asked her ""so any flight is OK, just have to go out from Tanzania?"" she said ""yes"". So I booked the first flight I could to Rwanda with Kenya Airlines, costing me £327.71. Bare in mind, we did NOT have a visa either to Kenya (there is the connection) or Rwanda! So if immigration would see this, they wouldn't let us in because of the lack of visa to those countries! After I booked a ticket a manager arrived and told the lady in Vietnamese (they didn't want me to understand) that we are free to go, because what we have is enough! Meaning I purchased those tickets for nothing! During this whole process your staff acted very unprofessionally, making me very stressed, which gave me chest ache. I had an aortic valve replacement, this kind of treatment and stress is very bad for my heart! They also disregarded my serious latex allergy, kept touching me and our things with Latex gloves, eventho we repeatedly ask them not to do that, OR use the gloves I carry with myself which are Latex free. During this whole process we felt discriminated as my wife is Vietnamese and I am European and these people seemed jealous that we can leave Vietnam despite the lockdowns."
339,Hope to see you soon on my next vacation. Good service.
340,Emirates takes no responsibility regarding their tickets and no follow-up from their cooperators that was not business class. Emirates business class is by the way not like they promise. Fly with Qatar instead :-) I will follow this advise I got from other dissatisfied with Emirates.
341,The only reason I give this a one is because I can't give a zero.The reason they get one star is because of their association with Arsenal FC whose senior management team are absolutely disgusting.
342,Been waiting for one hour now to a recorded message. no mention of where I am in the queue. I'm trying to rebook a flight that was cancelled due to pandemic. Instead of having my credit on my Skywards account I have to phone the Birmingham tel number to rebook. Surely it's easier to have the credit provided electronically?
